 ,hallow_back,rilegatura_moderna,Colonna1,Collocazione,roman_converted,numero_del_codice,numerazione_araba,numerazione_romana_alternativa,ulteriore_numerazione_arabaoromana,identificativo_parte,Spagnolo,note,titolo,materiale,datazione_i,datazione_f,lingua,fogli,altezza,ampiezza,rilegatura,tipo_rilegatura,materiale_rilegatura,palinsesto,testo_indistinto,danni_fuoco,cancro_pergamena,margini_danneggiati,danni_umidita,restaurato,anno_restauro,dorature,disegni,miniato,colori,rosso,blue
1000,,,,[E 3 8],971,DCCCCLXXI,,MLXXVII,,,680-685,due buste moderne denominate 71 A a cui diamo il numero di catena 6 e 7,Maffei Scipione: Epistolario,cartaceo,1700,1800,,,,,fogli sciolti,fogli raccolti in busta,,,,,,,,,,,,,,,
1001,,,,[E 3 9],972,DCCCCLXXII,,MLXXVIII,,,680-685,,Maffei Scipione: Epistolario,cartaceo,1700,1800,,,,,fogli sciolti,fogli raccolti in busta,,,,,,,,,,,,,,,
1002,,,,[E 3 10],973,DCCCCLXXIII,,MLXXIX,,,680-685,,Maffei Scipione: Epistolario,cartaceo,1700,1800,,,,,fogli sciolti,fogli raccolti in busta,,,,,,,,,,,,,,,
1003,,,,[E 3 11],974,DCCCCLXXIV,,MLXXX,,,680-685,,Maffei Scipione: Epistolario,cartaceo,1700,1800,,,,,fogli sciolti,fogli raccolti in busta,,,,,,,,,,,,,,,
1004,,,,[E 4 1],975,DCCCCLXXV,,MLXXXI,,,680-685,,Maffei Scipione: Epistolario,cartaceo,1700,1800,,,,,fogli sciolti,fogli raccolti in busta,,,,,,,,,,,,,,,
1005,,,,[E 3 1],976,DCCCCLXXVI,,MLXXXII,,,680-685,,Maffei Scipione: Epistolario,cartaceo,1700,1800,,,,,fogli sciolti,fogli raccolti in busta,,,,,,,,,,,,,,,
1006,,,,[E 4 4],977,DCCCCLXXVII,,MLXXXI,,,685-687,,"Maffei Scipione: Memorie, scritti vari suoi o di altri che si riferiscono alla sua vita",cartaceo,1700,1800,,,,,fogli sciolti,fogli e fascicoli raccolti in busta,,,,,,,,,,,,,,,
1007,,,,[E 4 5],978,DCCCCLXXVIII,,,,,687,,"Scipionis Maffei Biblioth. manuscripta Captularis recognita, Digesta suppleta sub auspiciis amplissimi Capituli ab Ant. Masotti biblioth.",cartaceo,1775,1800,,44,386,272,rilegato,tutta pella con borchie,,,,,,,,,,,,,,,
1008,,,,[E 4 5 BIS],979,DCCCCLXXIX,,,,,687,,"Scipionis Maffei Biblioth. manuscripta Captularis recognita, Digesta suppleta sub auspiciis amplissimi Capituli ab Ant. Masotti biblioth.",cartaceo,1775,1800,,379,386,272,rilegato,tutta pella con borchie,,,,,,,,,,,,,,,
1009,,,,[B 3 8],980,DCCCCLXXX,,MLXXXII,,,688,,Ottolino co. Ottolini: Sua corrispondenza letteraria,cartaceo,1700,1800,,,,,fogli sciolti,fogli raccolti in busta,,,,,,,,,,,,,,,
1010,,,,[B 3 9],981,DCCCCLXXXI,,MLXXXIII,,,688,,Ottolino co. Ottolini: Sua corrispondenza letteraria,cartaceo,1700,1800,,,,,fogli sciolti,fogli raccolti in busta,,,,,,,,,,,,,,,
1011,,,,[B 3 10],982,DCCCCLXXXII,,MLXXXIV,,,689,,Muselli m. Gian Francesco: Corrispondenza letteraria,cartaceo,1700,1800,,,,,fogli sciolti,fogli raccolti in busta,,,,,,,,,,,,,,,
1012,,,,A 4 1,983,DCCCCLXXXIII,,MLXXXV,DCCCCLXXXIV,,689-692,,Documenti sulla Capitolare biblioteca avanti m. Giuliari,cartaceo,1800,1900,,,,,fogli sciolti,fogli raccolti in busta,,,,,,,,,,,,,,,
1013,,,,A 4 1,984,DCCCCLXXXIV,,MLXXXV,DCCCCLXXXIV,,689-692,DCCCCLXXXIII ora nella busta DCCCCLXXXIV,Documenti sulla Capitolare biblioteca avanti m. Giuliari,cartaceo,1800,1900,,,,,fogli sciolti,fogli raccolti in busta,,,,,,,,,,,,,,,
1014,,,,[A 4 2],985,DCCCCLXXXV,,,,,692,,M. Giambatt. Carlo Giuliari: Storia della Capitolare biblioteca,cartaceo,1800,1900,,,,,fascicoli,fascicoli raccolti in busta,,,,,,,,,,,,,,,
1015,,,,[A 4 3],986,DCCCCLXXXVI,,,,,693,,Giuliari m. Gia. B.: Storia della Capitolare,cartaceo,1800,1900,,,306,220,fascicoli,fascicoli raccolti in busta,,,,,,,,,,,,,,,
1016,,,,A 4 4,987,DCCCCLXXXVII,,,,,693-696,,"Giuliari m. Gia. B.C.: Memorie sulla Capitolare, Corrispondenze",cartaceo,1850,1900,,,,,fogli sciolti,fogli raccolti in busta,,,,,,,,,,,,,,,
1017,,,,A 4 5,988,DCCCCLXXXVIII,,,,,693-696,,"Giuliari m. Gia. B.C.: Memorie sulla Capitolare, Corrispondenze",cartaceo,1850,1900,,,,,fogli sciolti,fogli raccolti in busta,,,,,,,,,,,,,,,
1018,,,,A 4 6,989,DCCCCLXXXIX,,,,,696-698,,Giuliari m. G.B.C.: Spicilegium Capitul. bibliot.,cartaceo,1800,1900,,,,,fogli sciolti,fogli raccolti in busta,,,,,,,,,,,,,,,
1019,,,,A 4 7,990,DCCCCXC,,,,,698-699,,Giuliari m. C.B.C.: Studi sul Maffei,cartaceo,1800,1900,,,,,fogli sciolti,fogli e fascicoli raccolti in busta,,,,,,,,,,,,,,,
1020,,,,A 4 8,991,DCCCCXCI,,,,,700,,Giuliari m. Gio. B.C.: Santi veronesi e Storia della Capitolare,cartaceo,1800,1900,,,,,fogli sciolti,fogli raccolti in busta,,,,,,,,,,,,,,,
1021,,,,A 4 9,992,DCCCCXCII,,,,,700,,Giuliari m. G.B.C.: Inni liturgici e sacri della Capitolare,cartaceo,1800,1900,,,142,87,fogli sciolti,fogli raccolti in busta,,,,,,,,,,,,,,,
1022,,,,A 4 10,993,DCCCCXCIII,,,,,701,,Giuliari m. G.B. Carlo: Miscellanea,cartaceo,1800,1900,,,,,fogli sciolti,fogli e fascicoli raccolti in busta,,,,,,,,,,,,,,,
1023,,,,[B 4 1],994,DCCCCXCIV,,,,,701-703,collocazione B4 1 rinvenuto  in scaffale B2.,Giuliari m. G.B.C.: Miscellanea,cartaceo,1800,1900,,,,,fogli sciolti,fogli e fascicoli raccolti in busta,,,,,,,,,,,,,,,
1024,,,,[B 4 2],995,DCCCCXCV,,,,,703-704,,Memorie e lettere per l'ufficio di s. Zenone vesc. di Verona,cartaceo,1800,1900,,,,,fogli sciolti,fogli raccolti in busta,,,,,,,,,,,,,,,
1025,,,,[B 4 3],996,DCCCCXCVI,,,,,704,,Vignola don Ignazio: Istruzione religiosa,cartaceo,1800,1900,,148,245,177,rilegato,mezza pelle,,,,,,,,,,,,,,,
1026,,,,[B 4 4],997,DCCCCXCVII,,,,,704-705,,Olcius Ioannes Petrus: Tractatus dogmativi varii,cartaceo,1800,1900,,134,255,185,rilegato,cartoncino,,,,,,,,,,,,,,,
1027,,,,[B 4 5],998,DCCCCXCVIII,,,,,704-705,,Olcius Ioannes Petrus: Tractatus dogmativi varii,cartaceo,1800,1900,,175,255,185,rilegato,cartoncino,,,,,,,,,,,,,,,
1028,,,,[B 4 6],999,DCCCCXCIX,,,,,704-705,,Olcius Ioannes Petrus: Tractatus dogmativi varii,cartaceo,1800,1900,,123,255,185,rilegato,cartoncino,,,,,,,,,,,,,,,
1029,,,,[B 4 7],1000,M,,,,,704-705,,Olcius Ioannes Petrus: Tractatus dogmativi varii,cartaceo,1800,1900,,111,255,185,rilegato,cartoncino,,,,,,,,,,,,,,,
1030,,,,[B 4 8],1001,MI,,,,,705,,Righi d. Lazaro: Istitutiones theologicae,cartaceo,1700,1800,,156,240,178,rilegato,cartoncino,,,,,,,,,,,,,,,
1031,,,,[B 4 9],1002,MII,,,,,705,,Righi d. Lazaro: Istitutiones theologicae,cartaceo,1700,1800,,109,227,182,rilegato,cartoncino,,,,,,,,,,,,,,,
1032,,,,[B 4 10],1003,MIII,,,,,706,,Institutiones philosophicae,cartaceo,1800,1900,,104,235,177,rilegato,cartoncino,,,,,,,,,,,,,,,
1033,,,,[B 4 11],1004,MIV,,,,,706,,Bertolini Giuseppe: La basilica veronese di S. Stefano protomartire,cartaceo,1850,1900,,48,266,194,rilegato,cartoncino,,,,,,,,,,,,,,,
1034,,,,[B 4 12],1005,MV,,,,,706-707,,Conati m. Giovanni Battista: Discorsi sacri e morali e Lezioni d'arte,cartaceo,1800,1900,,,245,180,fascicoli,fascicoli raccolti in busta,,,,,,,,,,,,,,,
1035,,,,[B 4 13],1006,MVI,,,,,707-708,,M. Conati G.B.: Panegirici e poesie,cartaceo,1800,1900,,,,,fascicoli,fascicoli raccolti in busta,,,,,,,,,,,,,,,
1036,,,,[B 4 14],1007,MVII,,,,,708-709,,Gilardoni Giuseppe Maria arcip. di S. Martino B.A.: Dissertazioni,cartaceo,1800,1900,,80,300,230,rilegato,cartoncino,,,,,,,,,,,,,,,
1037,,,,[B 4 15],1008,MVIII,,,,,708-709,,Gilardoni Giuseppe Maria arcip. di S. Martino B.A.: Dissertazioni,cartaceo,1800,1900,,44,300,230,rilegato,cartoncino,,,,,,,,,,,,,,,
1038,,,,[B 4 16],1009,MIX,,,,,709-710,,Miscellanea,cartaceo,1600,1800,,,,,fogli sciolti,fogli e fascicoli raccolti in busta,,,,,,,,,,,,,,,
1039,,,,[B 4 17],1010,MX,,,,,710-712,,Miscellanea,cartaceo,1600,1800,,,,,fogli sciolti,fogli e fascicoli raccolti in busta,,,,,,,,,,,,,,,
1040,,,,[B 4 18],1011,MXI,,,,,712,riportato come B4 19.,Ottoboni Antonio: Paterne istruzioni al figlio,cartaceo,1675,1700,,27,237,170,rilegato,pelle,,,,,,,,,,,,,,,
1041,,,,[B 4 19],1012,MXII,,,,,713,,Libro di cerimonie ecclesiastiche,cartaceo,1700,1800,,85,170,116,rilegato,pergamena,,,,,,,,,,,,,,,
1042,,,,[B 4 20],1013,MXIII,,,,,713,,De casibus reservatis in diocesi veronensi,cartaceo,1800,1900,,20,120,188,rilegato,cartoncino,,,,,,,,,,,,,,,
1043,,,,[B 4 21],1014,MXIV,,,,,713-714,,Gazali don Isidoro: Realissime crocifissioni della v.s. Chiara Isab. Fornari,cartaceo,1725,1800,,46,142,78,rilegato,,,,,,,,,,,,1,,,,
1044,,,,[B 4 22],1015,MXV,,,,,714,,Curtoni d. G.B.: Sunto di storia della filosofia greca,cartaceo,1850,1900,,215,290,195,rilegato,mezza tela,,,,,,,,,,,,,,,
1045,,,,[B 4 23],1016,MXVI,,,,,715,,Curtoni G.B.: Riflessioni critiche su G.B. Vico,cartaceo,1850,1900,,142,290,115,rilegato,,,,,,,,,,,,,,,,
1046,,,,[B 4 24],1017,MXVII,,,,,715,,Curtoni G.B.: Riflessioni critiche su G.B. Vico,cartaceo,1850,1900,,57,290,115,rilegato,,,,,,,,,,,,,,,,
1047,,,,[B 4 25],1018,MXVIII,,,,,715-716,,Curtoni G.B.: Storia dell'Egitto antico e cronologia degli Iksos,cartaceo,1850,1900,,103,290,195,rilegato,cartoncino,,,,,,,,,,,,,,,
1048,,,,[B 4 27],1019,MXIX,,,,,715-716,,Curtoni G.B.: Storia dell'Egitto antico e cronologia degli Iksos,cartaceo,1850,1900,,115,290,195,rilegato,cartoncino,,,,,,,,,,,,,,,
1049,,,,[B 4 28],1020,MXX,,,,,716,,"Curtoni G.B.: Lettere critiche sull'opera del prof. Corazzini ""I tempi preistorici""",cartaceo,1850,1900,,66,290,195,rilegato,cartoncino,,,,,,,,,,,,,,,
1050,,,,[B 4 29],1021,MXXI,,,,,717,,Curtoni G.B.: I tempi preromani,cartaceo,1850,1900,,122,290,195,rilegato,cartoncino,,,,,,,,,,,,,,,
1051,,,,[B 4 30],1022,MXXII,,,,,717,,"Curtoni G.B.: Mare nuovo del Sahara, L'uomo primitivo, Le civiltà",cartaceo,1850,1900,,108,290,195,rilegato,mezza tela,,,,,,,,,,,,,,,
1052,,,,[B 4 31],1023,MXXIII,,,,,717,,"Curtoni G.B.: Risposta amichevole all'autore degli ""Scritti amichevoli pei deisti""",cartaceo,1850,1900,,59,290,295,rilegato,mezza tela,,,,,,,,,,,,,,,
1053,,,,[B 4 32],1024,MXXIV,,,,,718,,Curtoni G.B.: Cenni di scienze metafisiche e naturali,cartaceo,1850,1900,,66,290,195,rilegato,mezza tela,,,,,,,,,,,,,,,
1054,,,,[B 4 33],1025,MXXV,,,,,718,,Curtoni G.B.: Studi di storia naturale fossile,cartaceo,1850,1900,,48,290,195,rilegato,cartoncino,,,,,,,,,,,,,,,
1055,,,,[B 4 34],1026,MXXVI,,,,,719,,"Curtoni G.B.: Antropologia, orgine e antichità dell'uomo",cartaceo,1850,1900,,55,290,195,rilegato,cartoncino,,,,,,,,,,,,,,,
1056,,,,[B 4 35],1027,MXXVII,,,,,719,,"Curtoni G.B.: Storia d'America, del Perù e del Messico",cartaceo,1850,1900,,74,290,195,rilegato,mezza tela,,,,,,,,,,,,,,,
1057,,,,[B 4 36],1028,MXXVIII,,,,,719,,Curtoni G.B.: Civiltà meno colte ed istruite dei Due mondi,cartaceo,1850,1900,,217,290,195,rilegato,cartoncino,,,,,,,,,,,,,,,
1058,,,,[B 4 37],1029,MXXIX,,,,,720,,Curtoni G.B.: Astronomia parellelografico-popolare,cartaceo,1850,1900,,157,280,185,rilegato,mezza tela,,,,,,,,,,,,,,,
1059,,,,B 4 38,1030,MXXX,,,,,720-721,,Curtoni G.B.: Opuscoli di varia erudizione,cartaceo,1800,1900,,,,,fascicoli,fascicoli raccolti in busta,,,,,,,,,,,,,,,
1060,,,,[C 1 2],1031,MXXXI,,,,,721-723,,Vignola m. Paolo: Memorie di erudizione e di storia,cartaceo,1800,1900,,,,,fogli sciolti,fogli raccolti in busta,,,,,,,,,,,,,,,
1061,,,,[C 1 1],1032,MXXXII,,,,,723-724,,Vignola m. Paolo: Per la storia della Capitolare Corrispondenza letteraria 1866-1894,cartaceo,1800,1900,,,,,fogli sciolti,fogli raccolti in busta,,,,,,,,,,,,,,,
1062,,,,[C 1 3],1033,MXXXIII,,,,,724-725,,Vignola m. Paolo: Raccolta di carte antiche dell'archivio capitolare,cartaceo,1300,1700,,,,,fogli sciolti,fogli raccolti in busta,,,,,,,,,,,,,,,
1063,,,,[C 1 4],1034,MXXXIV,,,,,726-727,,Vignola m. Paolo: Raccolta di carte dei secoli XIV-XVII,cartaceo,1300,1700,,,,,fogli sciolti,fogli raccolti in busta,,,,,,,,,,,,,,,
1064,,,,[C 1 5],1035,MXXXV,,,,,727-728,,Vignola m. Paolo: Carte antiche,cartaceo,1300,1800,,,,,fogli sciolti,fogli e fascicoli raccolti in busta,,,,,,,,,,,,,,,
1065,,,,[C 1 6],1036,MXXXVI,,,,,728-731,,Vignola m. Paolo: Raccolta di carte antiche,cartaceo,1300,1900,,,,,fogli sciolti,fogli e fascicoli raccolti in busta,,,,,,,,,,,,,,,
1066,,,,[C 1 7],1037,MXXXVII,,,,,731,,Vignola m. Paolo: Carte antiche,cartaceo,1300,1800,,,,,fogli sciolti,fogli e fascicoli raccolti in busta,,,,,,,,,,,,,,,
1067,,,,[C 1 8],1038,MXXXVIII,,,,,731-733,,Miscellanea,cartaceo,1600,1900,,,,,fogli sciolti,fogli e fascicoli raccolti in busta,,,,,,,,,,,1,,,,
1068,,,,[C 1 9],1038,MXXXVIII A,,,,,734,,Vignola Paolo: Carteggio scavi canonicato,cartaceo,,,,,,,,,,,,,,,,,,,,,,,
1069,,,,[C 1 10],1039,MXXXIX,,,,,734,,Cataloghi antichi della Capitolare biblioteca,cartaceo,1600,1900,,,,,fascicoli,fascicoli e volumi raccolti in busta,,,,,,,,,,,,,,,
1070,,,,[D A 1],1040,MXL,,,,,734-735,8 volumi,Catalogo della bibl. Capitolare per materie,cartaceo,1700,1800,,200,275,200,rilegato,cartoncino,,,,,,,,,,,,,,,
1071,,,,[D 1 1],1041,MXLI,,,,,735,,Catalogus bibliothecae Capitularis secundum auctorum cognomina,cartaceo,1700,1800,,,312,240,rilegato,mezza pelle,,,,,,,,,,,,,,,
1072,,,,[D 1 2],1042,MXLII,,,,,735,,Catalogus bibliothecae Capitularis secundum auctorum cognomina,cartaceo,1700,1800,,,312,240,rilegato,mezza pelle,,,,,,,,,,,,,,,
1073,,,,[D 1 3],1043,MXLIII,,,,,735-736,grossi volumi,Giuliari m. G.B.C.: Catalogo dei codici capitolari,cartaceo,1850,1900,,314,,,rilegato,cartoncino,,,,,,,,,,,,,,,
1074,,,,[D 1 4],1044,MXLIV,,,,,735-736,,Giuliari m. G.B.C.: Catalogo dei codici capitolari,cartaceo,1850,1900,,304,,,rilegato,cartoncino,,,,,,,,,,,,,,,
1075,,,,[D 1 5],1045,MXLV,,,,,735-736,,Giuliari m. G.B.C.: Catalogo dei codici capitolari,cartaceo,1850,1900,,293,,,rilegato,cartoncino,,,,,,,,,,,,,,,
1076,,,,[D 1 6],1046,MXLVI,,,,,736,,Giuliari m. G.B.C.: Note paleografiche sui codici capitolari e indici dei medesimi,cartaceo,1850,1900,,200,258,185,rilegato,cartoncino,,,,,,,,,,,,,,,
1077,,,,[D 1 7],1047,MXLVII,,,,,736,,Giuliari m. G.B.C.: Note paleografiche sui codici capitolari e indici dei medesimi,cartaceo,1850,1900,,199,258,185,rilegato,cartoncino,,,,,,,,,,,,,,,
1078,,,,[A D 2],1048,MXLVIII,,,,,736-738,,Antiphonarium Capituli veronensis,membranaceo,1450,1500,,165,490,363,rilegato,assi coperte di pelle con disegni e grossi borchioni,,,,,,,,,,1,,1,1,,
1079,,,,[A C 1],1049,MXLIX,,,,,736-738,,Antiphonarium Capituli veronensis,membranaceo,1450,1500,,167,521,381,rilegato,assi coperte di pelle con disegni e grossi borchioni,,,,,,,,,,1,,1,1,,
1080,,,,[B A 1],1050,ML,,,,,736-738,,Antiphonarium Capituli veronensis,membranaceo,1450,1500,,243,510,350,rilegato,assi coperte di pelle con disegni e grossi borchioni,,,,,,,,,,1,,1,1,,
1081,,,,[A B 1],1051,MLI,,,,,736-738,,Antiphonarium Capituli veronensis,membranaceo,1450,1500,,233,517,364,rilegato,assi coperte di pelle con disegni e grossi borchioni,,,,,,,,,,1,,1,1,,
1082,,,,[A B 2],1052,MLII,,,,,736-738,,Antiphonarium Capituli veronensis,membranaceo,1450,1500,,198,570,380,rilegato,assi coperte di pelle con disegni e grossi borchioni,,,,,,,1,,,1,,1,1,,
1083,,,,[A A 1],1053,MLIII,,,,,736-738,,Antiphonarium Capituli veronensis,membranaceo,1450,1500,,196,480,365,rilegato,assi coperte di pelle con disegni e grossi borchioni,,,,,,,1,,,1,,1,1,,
1084,,,,[A A 2],1054,MLIV,,,,,736-738,,Antiphonarium Capituli veronensis,membranaceo,1450,1500,,222,510,372,rilegato,assi coperte di pelle con disegni e grossi borchioni,,,,,,,,,,1,,1,1,1,
1085,,,,[B D 1],1055,MLV,,,,,736-738,,Antiphonarium Capituli veronensis,membranaceo,1450,1500,,239,518,374,rilegato,assi coperte di pelle con disegni e grossi borchioni,,,,,,,,,,1,,1,1,1,
1086,,,,[B E 2],1056,MLVI,,,,,739-741,,Antiphonarium diurnum vol. 1,membranaceo,1450,1500,,229,575,368,rilegato,assi coperte di pelle con borchioni,,,,,,,,,,1,,1,1,1,
1087,,,,[B E 1],1057,MLVII,,,,,739-741,,Antiphonarium diurnum vol. 2,membranaceo,1450,1500,,232,551,385,rilegato,assi coperte di pelle con borchioni,,,,,,,,,,1,,1,1,1,
1088,,,,[B D 2],1058,MLVIII,,,,,739-741,,Antiphonarium diurnum vol. 3,membranaceo,1450,1500,,199,562,360,rilegato,assi coperte di pelle con borchioni,,,,,,,,,,1,,1,1,1,
1089,,,,[B C 1],1059,MLIX,,,,,739-741,,Antiphonarium diurnum vol. 4,membranaceo,1450,1500,,201,565,388,rilegato,assi coperte di pelle con borchioni,,,,,,,,,,1,,1,1,1,
1090,,,,[B C 2],1060,MLX,,,,,739-741,,Antiphonarium diurnum vol. 5,membranaceo,1450,1500,,95,550,373,rilegato,assi coperte di pelle con borchioni,,,,,,,,,,1,,1,1,1,
1091,,,,[B B 1],1061,MLXI,,,,,739-741,,Antiphonarium diurnum vol. 6,membranaceo,1450,1500,,88,560,392,rilegato,assi coperte di pelle con borchioni,,,,,,,,,,1,,1,1,1,
1092,,,,[B B 2],1062,MLXII,,,,,741-742,,Missae sanctorum,membranaceo,1450,1500,,149,465,350,rilegato,assi coperte di pelle e borchioni,,,,,,,,,,1,,1,1,1,
1093,,,,[A E 2],1063,MLXIII,,,,,741-742,numero foglio non sicuro,Missae sanctorum,membranaceo,1450,1500,,158,465,320,rilegato,assi coperte di pelle e borchioni,,,,,,,,,,1,,1,1,1,
1094,,,,[A C 2],1064,MLXIIII,,,,,742,segnato MLXIV,Horae diurne et imni,membranaceo,1700,1700,,150,380,290,rilegato,"assi coperte di pelle con grosse borchie, angoli e fermagli di ottone",,,,,,,,,,,,1,1,1,
1095,,,,E B *,1065,MLXV,,,,,742,,Antiphonae in communi sanctorum,membranaceo,1450,1500,,84,450,326,rilegato,assi coperte di pelle e borchioni e angoli ferrati,,,,,,,,,,,,1,,1,
1096,,,,E B 5,1066,MLXVI,,,,,743,,Agenda pro defunctis,membranaceo,1450,1500,,50,385,270,rilegato,assi coperte di pelle con disegni e borchioni,,,,,,,,,,,,,,1,1
1097,,,,E B *,1067,MLXVII,,,,,743,,Missae in festis sanctorum propr. Ecclesiae veronensis,cartaceo,1750,1800,,120,445,314,rilegato,pelle con borchie,,,,,,,,,,,,,,1,
1098,,,,E B 6,1068,MLXVIII,,,,,744,,Antiphonarium medii chori Capituli veron.,membranaceo,1450,1500,,48,440,322,rilegato,cartoncino,,,,,,,,,,,,1,,1,1
1099,,,,E B *,1069,MLXIX,,,,,744,,"Messe, mattutini e lamentazione per la Settimana santa",cartaceo,1800,1900,,45,275,194,rilegato,cartoncino,,,,,,,,,,,,,,,
1100,,,,E B 8,1070,MLXX,,,,,745,,Toni diversi a 4 voci,cartaceo,1800,1800,,78,470,350,rilegato,mezza pelle,,,,,,,,,,,,,,,
1101,,,,E B *,1070,MLXX A,,,,,745,,Falsobordoni,cartaceo,,,,55,,,,,,,,,,,,,,,,,,,
1102,,,,E B 10,1071,MLXXI,,,,,745,,Bellante: Introiti a 4 voci,cartaceo,1700,1800,,57,500,330,rilegato,mezza pelle,,,,,,,,,,,,,,,
1103,,,,E B *,1072,MLXXII,,,,,746,,Canti liturgici musicati,cartaceo,1800,1900,,147,480,354,rilegato,pelle,,,,,,,,,,,,,,,
1104,,,,E B 12,1073,MLXXIII,,,,,746,,Bernardi Stefano: misse a 4 voci,cartaceo,1600,1700,,29,520,390,rilegato,mezza pergamena,,,,,,,,,,,,,,,
1105,,,,E B 13,1074,MLXXIV,,,,,747,4 fascicoli separati,Metodi vari di canto fermo ed altri canti,cartaceo,1700,1900,,,,,rilegato,cartoncino,,,,,,,,,,,,,,,
1106,,,,E B 14,1075,MLXXV,,,,,747,,Brugnoli Geremia: Messe a 5 voci,cartaceo,1600,1700,,,553,398,fogli sciolti,nessuna legatura,,,,,,,,,,,,,,,
1107,,,,E B 15,1076,MLXXVI,,,,,748,,Bellante Dionisio: Dominica in Palmis,cartaceo,1600,1700,,38,545,410,rilegato,mezza pergamena,,,,,,,,,,,,,,1,
1108,,,,E B 16,1076,MLXXVI A,,,,,748,,Corale ad Vesperas,cartaceo,1800,1900,,63,425,300,rilegato,pelle con borchie,,,,,,,,,,,,,,,
1109,,,,[E B 17],1076,MLXXVI B,,,,,748,,Falsobordoni,cartaceo,1600,1800,,84,435,306,rilegato,pelle,,,,,,,,,,,,,,,
1110,,,,[D 1 8],1077,MLXXVII,,,,,748-749,,Musica varia,cartaceo,1700,1900,,,,,fogli sciolti,fogli e fascicoli raccolti in busta,,,,,,,,,,,,,,,
1111,,,,[D 1 9],1078,MLXXVIII,,,,,749,,Gazzaniga: Miserere (autori diversi),cartaceo,1700,1800,,,,,fascicoli,fascicoli raccolti in cartoncino,,,,,,,,,,,,,,,
1112,,,,[D 1 10],1079,MLXXIX,,,,,749-750,unica busta,Musica varia,cartaceo,1700,1900,,,,,fascicoli,fascicoli raccolti in busta,,,,,,,,,,,,,,,
1113,,,,[D 1 10],1080,MLXXX,,,,,750,unica busta,Musica sacra e profana,cartaceo,1700,1900,,,,,fascicoli,fascicoli raccolti in busta,,,,,,,,,,,,,,,
1114,,,,[D 1 11],1081,MLXXXI,,,,,750-751,,Inni liturgici,cartaceo,1700,1900,,,,,fascicoli,fascicoli raccolti in busta,,,,,,,,,,,,,,,
1115,,,,[C 2 1],1082,MLXXXII,,,,,751-752,,Inni liturgici,cartaceo,1700,1900,,,,,fascicoli,fascicoli raccolti in busta,,,,,,,,,,,,,,,
1116,,,,[C 2 2],1083,MLXXXIII,,,,,752,,Musica varia,cartaceo,1700,1800,,,,,fascicoli,fascicoli raccolti in busta,,,,,,,,,,,,,,,
1117,,,,[C 2 3],1084,MLXXXIV,,,,,753,,Giacometti don Bartolomeo: Musica varia,cartaceo,1700,1800,,,,,fogli sciolti,fogli e fascicoli raccolti in busta,,,,,,,,,,,,,,,
1118,,,,[C 2 4],1085,MLXXXV,,,,,753,,Gazzaniga Giuseppe: Miserere a 4 voci,cartaceo,1700,1800,,,,,fascicoli,fascicoli raccolti in busta,,,,,,,,,,,,,,,
1119,,,,[C 2 5],1086,MLXXXVI,,,,,753-754,,Gazzaniga Giuseppe: Musica varia,cartaceo,1700,1800,,,,,fascicoli,fascicoli raccolti in busta,,,,,,,,,,,,,,,
1120,,,,[C 2 6],1087,MLXXXVII,,,,,754,,D.B.T.: Musica varia,cartaceo,1800,1900,,,,,fascicoli,fascicoli raccolti in busta,,,,,,,,,,,,,,,
1121,,,,[C 2 7],1088,MLXXXVIII,,,,,755,sembra dal Barba,Musica varia,cartaceo,1700,1900,,,,,fascicoli,fascicoli raccolti in busta,,,,,,,,,,,,,,,
1122,,,,[C 2 8],1089,MLXXXIX,,,,,755,,Dal Barba Daniele: Musica varia,cartaceo,1700,1800,,,,,fascicoli,fascicoli raccolti in busta,,,,,,,,,,,,,,,
1123,,,,[C 2 9],1090,MXC,,,,,756,sembra dal Barba,Musica sacra di vari autori,cartaceo,1700,1900,,,,,fascicoli,fascicoli raccolti in busta,,,,,,,,,,,,,,,
1124,,,,[D 2 1],1091,MXCI,,,,,756,,Musica sacra e profana di vari autori,cartaceo,1700,1900,,,,,fascicoli,fascicoli raccolti in busta,,,,,,,,,,,,,,,
1125,,,,[D 2 2],1092,MXCII,,,,,757,GAZZANIGA DUE MISERERE A TRE VOCI,Zanatta Domenico: Musica sacra varia,cartaceo,1700,1800,,,,,fascicoli,fascicoli raccolti in busta,,,,,,,,,,,,,,,
1126,,,,[D 2 3],1093,MXCIII,,,,,757,,Gazzaniga: Musica sacra varia,cartaceo,1700,1800,,,,,fascicoli,fascicoli raccolti in busta,,,,,,,,,,,,,,,
1127,,,,[D 2 4],1094,MXCIV,,,,,757-758,,Gazzaniga: Musica sacra varia,cartaceo,1700,1800,,,,,fascicoli,fascicoli raccolti in busta,,,,,,,,,,,,,,,
1128,,,,[D 2 5],1095,MXCV,,,,,758-759,GAZZANIGA DUE MISERERE A TRE VOCI,Giacometti d. Bartol.: Musica sacra varia,cartaceo,1700,1800,,,,,fascicoli,fascicoli raccolti in busta,,,,,,,,,,,,,,,
1129,,,,[D 2 6],1096,MXCVI,,,,,759,,Musica sacra di vari autori,cartaceo,1700,1900,,,,,fascicoli,fascicoli raccolti in busta,,,,,,,,,,,,,,,
1130,,,,[D 2 7],1097,MXCVII,,,,,759,,Musica sacra di vari autori,cartaceo,1700,1900,,,,,fascicoli,fascicoli raccolti in busta,,,,,,,,,,,,,,,
1131,,,,[D 2 8],1098,MXCVIII,,,,,759-760,in sola busta.,Musica sacra di vari autori,cartaceo,1700,1900,,,,,fascicoli,fascicoli raccolti in busta,,,,,,,,,,,,,,,
1132,,,,[D 2 8],1099,MXCIX,,,,,760,in sola busta.,Musica sacra di vari autori,cartaceo,1700,1900,,,,,fascicoli,fascicoli raccolti in busta,,,,,,,,,,,,,,,
1133,,,,[C 3 1],1100,MC,,,,,761,,Musica sacra di autori vari,cartaceo,1700,1900,,,,,fascicoli,fascicoli raccolti in busta,,,,,,,,,,,,,,,
1134,,,,[C 3 2],1101,MCI,,,,,761-762,Vengono aggiunti MCI A-B-C,Musica sacra di vari autori,cartaceo,1700,1900,,,,,fascicoli,fascicoli raccolti in busta,,,,,,,,,,,,,,,
1135,,,,[C 3 3],1101,MCI,,,,,761-762,Vengono aggiunti MCI A-B-C,Musica sacra di vari autori,cartaceo,1700,1900,,,,,fascicoli,fascicoli raccolti in busta,,,,,,,,,,,,,,,
1136,,,,[C 3 4],1101,MCI,,,,,761-762,Vengono aggiunti MCI A-B-C,Musica sacra di vari autori,cartaceo,1700,1900,,,,,fascicoli,fascicoli raccolti in busta,,,,,,,,,,,,,,,
1137,,,,[C 3 5],1101,MCI,,,,,761-762,Vengono aggiunti MCI A-B-C,Musica sacra di vari autori,cartaceo,1700,1900,,,,,fascicoli,fascicoli raccolti in busta,,,,,,,,,,,,,,,
1138,,,,[C 3 6],1102,MCII,,,,,762-763,,Musica sacra di autori vari,cartaceo,1700,1900,,,,,fascicoli,fascicoli raccolti in busta,,,,,,,,,,,,,,,
1139,,,,[C 3 7],1103,MCIII,,,,,763,,Musica sacra di anonimo (Dion. Bellante),cartaceo,1700,1800,,,,,fascicoli,fascicoli raccolti in busta,,,,,,,,,,,,,,,
1140,,,,[C 3 8],1104,MCIV,,,,,763,,Musica sacra per la Settimana santa,cartaceo,1700,1800,,,,,fascicoli,fascicoli raccolti in busta,,,,,,,,,,,,,,,
1141,,,,[D 3 1],1105,MCV,,,,,763,,I salmi a due cori a 4 voci,cartaceo,1700,1800,,,,,fascicoli,fascicoli raccolti in busta,,,,,,,,,,,,,,,
1142,,,,[Caveau II Teca],1106,MCVI,,,,,764-765,sigilli in cera lacca,S. Laurentii Iustiniani De spirituali et casto verbi animaeque connubio,membranaceo,1425,1500,,110,146,116,rilegato,"assi coperte di velluto azzurro con angoli di metallo, fermaglio pure di metallo e due placche nel mezzo",,,,,,,,,,,,1,1,1,1
1143,,,,[Caveau II Teca],1107,MCVII,,,,,765,,S. Laurentii Iustiniani patriarchae venetiarum Fasciculus amoris,membranaceo,1425,1500,,104,145,118,rilegato,assi coperte di velluto cremisi con angoli e fermgaglio in metallo e placchette,,,,,,,,,,,,1,1,1,1
1144,,,,E 4 23,1108,MCVIII,,,,,766,,Miscellanea sacra,membranaceo,1200,1600,,,,,fogli sciolti,fogli raccolti in busta,,,,,,,,,,1,,1,1,,
1145,,,,[D 3 2],1109,MCIX,,,,,766-767,,Manuale sive Rituale veron. Eccl.,membranaceo,1175,1200,,71,213,135,rilegato,legatura antica con assi coperte di pelle rossa,,,,,,,,,,,,,,1,
1146,,,,D 3 3,1110,MCX,,,,,767-768,,Bernerdino (s.) da Siena: Predica de l'amor di Dio,membranaceo,1425,1500,,11,165,116,rilegato,cartoncino,,,,,,,,,,,,,,1,
1147,,,,[D 3 4],1111,MCXI,,,,,768,,Dotti: Satire,cartaceo,1700,1800,,233,215,153,rilegato,cartoncino,,,,,,,,,,,,,,,
1148,,,,[D 3 5],1112,MCXII,,,,,769,,Miscellanea scolastica,cartaceo,1800,1900,,,,,fascicoli,,,,,,,,,,,,,,,,
1149,,,,[D 3 6],1113,MCXIII,,,,,770,,Miscellanea,cartaceo,1700,1800,,,,,fascicoli,,,,,,,,,,,,,,,,
1150,,,,[V A 8 bis],1114,MCXIV,,,,,771,,Regole dell'Istituto delle missioni per la nigrizia,cartaceo,1800,1900,,22,415,220,,,,,,,,,,,,,,,,,
1151,,,,D 3 7,1115,MCXV,,,,,829,SUPP,Napoli: Missa a 13 voci,cartaceo,1600,1700,,,,,fascicoli,,,,,,,,,,,,,,,,
1152,,,,D 3 8,1116,MCXVI,,,,,829,,Autore ignoto: N. 2 messe a 8 voci,,1600,1700,,64,,,fascicoli,,,,,,,,,,,,,,,,
1153,,,,D 3 9,1117,MCXVII,,,,,829,,Autori ignoti: Domine ad adiuvandum,cartaceo,1600,1700,,25,,,raccolte di fogli,,,,,,,,,,,,,,,,
1154,,,,D 3 10,1118,MCXVIII,,,,,829,,"Asola Matteo: Psalmi, antiphone et canticum ad completorium",cartaceo,1600,1700,,20,,,fascicoli,,,,,,,,,,,,,,,,
1155,,,,D 3 11,1119,MCXIX,,,,,829,,Autore ignoto: Psalmi ad completorium,cartaceo,1600,1700,,61,,,raccolte di fogli,,,,,,,,,,,,,,,,
